{
  "acted_at": "2026-04-02T10:10:25Z",
  "action_type": "authorize",
  "actor_ref": "actor-v1-local-operator",
  "authority_class": "local_operator_governor",
  "governance_action_id": "governance_action-7c8dace2f6db47f698eb551628b3b589",
  "legitimacy_basis_ref": "legitimacy-basis-v1-second-proof-slice",
  "matter_ref": "matter-18e7dde8ddd0455dae6dc25b29a84908",
  "related_validation_ref": "validation-d34b085b6eb1471791710db828dc44d5",
  "related_witness_ref": "witness-aa09e1ff8cc24e93839c6d20175cf51b"
}
